{
  "version": "1.3.0",
  "last_updated": "2025-10-23T00:00:00Z",
  "scan_interval_ms": 30000,
  "roles": {
    "ai_engine": {
      "status": "connected",
      "latency_ms": 220,
      "driver": "gemini",
      "model": "gemini-2.5-flash",
      "health_endpoint": "http://localhost:3001/tool",
      "last_check": "2025-10-23T00:00:00Z",
      "issues": []
    },
    "workbench_db": {
      "status": "healthy",
      "latency_ms": 60,
      "driver": "firebase",
      "database_url": "https://project.firebaseio.com",
      "health_endpoint": "firebase://health",
      "last_check": "2025-10-23T00:00:00Z",
      "document_count": 0,
      "validation_queue_size": 0,
      "issues": []
    },
    "vault_db": {
      "status": "healthy",
      "latency_ms": 100,
      "driver": "neon",
      "connection_pool": "active",
      "health_endpoint": "postgresql://health",
      "last_check": "2025-10-23T00:00:00Z",
      "access_policy_enforced": true,
      "validator_layer_active": true,
      "issues": []
    },
    "integration_bridge": {
      "status": "connected",
      "latency_ms": 150,
      "driver": "composio-mcp",
      "registered_tools": 100,
      "health_endpoint": "http://localhost:3001/mcp/health",
      "last_check": "2025-10-23T00:00:00Z",
      "active_connections": 12,
      "issues": []
    }
  },
  "system_health": {
    "overall_status": "healthy",
    "roles_healthy": 4,
    "roles_degraded": 0,
    "roles_down": 0,
    "last_incident": null
  },
  "alerts": [],
  "viewer_schema": {
    "json_endpoint": "/manual/troubleshooting/system_diagnostics.json",
    "update_script": "/manual/scripts/status_check.ts",
    "websocket_support": false,
    "polling_recommended_ms": 30000
  }
}
