{
  "version": "1.3.0",
  "last_updated": "2025-10-23T14:32:18Z",
  "scan_interval_ms": 30000,
  "system_health": {
    "overall_status": "healthy",
    "roles_healthy": 4,
    "roles_degraded": 0,
    "roles_down": 0,
    "last_incident": null
  },
  "roles": {
    "ai_engine": {
      "status": "connected",
      "latency_ms": 187,
      "driver": "gemini",
      "model": "gemini-2.5-flash",
      "health_endpoint": "http://localhost:3001/tool",
      "last_check": "2025-10-23T14:32:18Z",
      "issues": []
    },
    "workbench_db": {
      "status": "healthy",
      "latency_ms": 43,
      "driver": "firebase",
      "database_url": "https://imo-creator-staging.firebaseio.com",
      "health_endpoint": "firebase://health",
      "last_check": "2025-10-23T14:32:18Z",
      "document_count": 127,
      "validation_queue_size": 3,
      "issues": []
    },
    "vault_db": {
      "status": "healthy",
      "latency_ms": 89,
      "driver": "neon",
      "connection_pool": "active",
      "health_endpoint": "postgresql://neon-serverless.tech/health",
      "last_check": "2025-10-23T14:32:18Z",
      "access_policy_enforced": true,
      "validator_layer_active": true,
      "issues": []
    },
    "integration_bridge": {
      "status": "connected",
      "latency_ms": 142,
      "driver": "composio-mcp",
      "registered_tools": 103,
      "health_endpoint": "http://localhost:3001/mcp/health",
      "last_check": "2025-10-23T14:32:18Z",
      "active_connections": 8,
      "issues": []
    }
  },
  "alerts": [],
  "viewer_schema": {
    "json_endpoint": "/manual/troubleshooting/system_diagnostics.json",
    "update_script": "/manual/scripts/status_check.ts",
    "websocket_support": false,
    "polling_recommended_ms": 30000
  }
}
